{
  "$schema": "https://json-schema.org/draft/2020-12/schema",
  "title": "AulasPropostasWrapper",
  "type": "object",
  "required": [
    "$schema",
    "versao",
    "dataGeracao",
    "modulosPedagogicos",
    "totalAulasPropostas",
    "aulasPropostas"
  ],
  "properties": {
    "$schema": {
      "type": "string"
    },
    "versao": {
      "type": "string"
    },
    "dataGeracao": {
      "type": "string"
    },
    "modulosPedagogicos": {
      "type": "array",
      "items": {
        "type": "object",
        "required": [
          "id",
          "nome",
          "descricao"
        ]
      }
    },
    "totalAulasPropostas": {
      "type": "integer",
      "minimum": 1
    },
    "aulasPropostas": {
      "type": "array",
      "items": {
        "type": "object",
        "required": [
          "id",
          "titulo",
          "moduloPedagogicoId",
          "habilidadePrincipalId",
          "prerequisitosAulas",
          "fontesCandidatas",
          "decisaoEditorial",
          "justificativa",
          "nivel",
          "praticaSaidaPlanejada",
          "inspecaoPendente"
        ],
        "properties": {
          "id": {
            "type": "string",
            "pattern": "^aula-prop-[0-9]{3}$"
          },
          "titulo": {
            "type": "string"
          },
          "moduloPedagogicoId": {
            "type": "string"
          },
          "habilidadePrincipalId": {
            "type": "string"
          },
          "habilidadesSecundarias": {
            "type": "array",
            "items": {
              "type": "string"
            }
          },
          "prerequisitosAulas": {
            "type": "array",
            "items": {
              "type": "string"
            }
          },
          "fontesCandidatas": {
            "type": "array",
            "items": {
              "type": "string"
            }
          },
          "decisaoEditorial": {
            "type": "string"
          },
          "justificativa": {
            "type": "string"
          },
          "nivel": {
            "type": "string"
          },
          "praticaSaidaPlanejada": {
            "type": "string"
          },
          "inspecaoPendente": {
            "type": "string"
          }
        }
      }
    }
  }
}